{
  "id": "viverse-polygon-streaming-threejs",
  "name": "viverse-polygon-streaming-threejs",
  "version": "1.3.0",
  "status": "active",
  "description": "Runtime Polygon Streaming .xrg integration for browser-based Three.js apps, including one shared StreamController, serialized/visible-only addModel, no parallel full-GLB fallback, wrapper events, authored vs bbox fitting, cameraTarget lifecycle, and VIVERSE preview service-worker origin.",
  "tags": [
    "viverse",
    "threejs",
    "polygon-streaming",
    "xrg",
    "streamcontroller",
    "runtime-streaming"
  ],
  "prerequisites": [
    "Three.js project",
    "@polygon-streaming/web-player-threejs@2.9.0-beta.2",
    "Ability to publish files at the app web root"
  ],
  "entrypoint": "SKILL.md",
  "patterns_dir": "patterns",
  "read_order": [
    "SKILL.md",
    "patterns/tankarena-debug-appendix.md"
  ],
  "dependencies": [
    "bundle:resilience"
  ]
}