{
  "id": "viverse-pls-starter-world",
  "name": "viverse-pls-starter-world",
  "version": "1.0.0",
  "status": "experimental",
  "description": "Adopt assets from a Polygon Streaming starter-world repository (Medieval Starter 100 in dkatz23/PolygonStreamingWorlds) into an existing Three.js game: reach the private repo, read the catalog and saved-scene formats, fix stream URLs, mount and fit streamed buildings per level, keep them out of gameplay lanes, gate stage start on model-load, and verify headlessly.",
  "tags": [
    "viverse",
    "threejs",
    "polygon-streaming",
    "starter-world",
    "catalog",
    "level-dressing",
    "loading-screen"
  ],
  "prerequisites": [
    "Existing Three.js game that already runs one shared Polygon Streaming StreamController (see viverse-polygon-streaming-threejs)",
    "GitHub access to the starter-world repository (collaborator invitation accepted, gh auth login done)",
    "Node.js 20+ and Playwright (headless Chromium) for verification"
  ],
  "entrypoint": "SKILL.md",
  "patterns_dir": "patterns",
  "read_order": [
    "SKILL.md",
    "patterns/adopt-buildings-into-a-game.md",
    "patterns/stage-loading-gate.md",
    "patterns/verification-recipes.md"
  ],
  "dependencies": [
    "viverse-polygon-streaming-threejs",
    "bundle:resilience"
  ]
}
